{
  "artifact_type": "scherzo.code_change_bundle.v2",
  "change": {
    "changed_files": [
      {
        "path": "docs/example.md",
        "status": "modified"
      }
    ],
    "diff": {
      "bytes": 47,
      "ref": "runs/run-2/execplan/code-change/diff.patch",
      "sha256": "03d60b35e28eedda292f897cf3df901b767016d1d4b5ecbc934ebf2bd8ad78cb"
    }
  },
  "entries": [
    {
      "artifact_type": "diff",
      "bytes": 47,
      "kind": "file",
      "media_type": "text/x-diff",
      "name": "diff",
      "ref": "runs/run-2/execplan/code-change/diff.patch",
      "sha256": "03d60b35e28eedda292f897cf3df901b767016d1d4b5ecbc934ebf2bd8ad78cb"
    },
    {
      "artifact_type": "plan_completion",
      "bytes": 62,
      "kind": "file",
      "media_type": "application/json",
      "name": "plan_completion",
      "ref": "runs/run-2/execplan/code-change/plan-completion.json",
      "sha256": "4cd32a5c9e69d8e96d2fc76382fe3dc73c1cb34f92bb43509efa7d9bfc27f0bb"
    },
    {
      "artifact_type": "scherzo-ci",
      "bytes": 49,
      "kind": "file",
      "media_type": "application/json",
      "name": "scherzo-ci",
      "ref": "runs/run-2/execplan/code-change/validation/scherzo-ci.json",
      "sha256": "b55e06b08ea7c49b652ebf502fa8a5a99dd6a5e326a60383783c4a7c43bfa51d"
    },
    {
      "artifact_type": "final-review",
      "bytes": 43,
      "kind": "file",
      "media_type": "application/json",
      "name": "final-review",
      "ref": "runs/run-2/execplan/code-change/review/final-review.json",
      "sha256": "901c63d7d00aa05be77f85b488662475ee888b1ce79414f4d60f515898faa0df"
    }
  ],
  "implementation_pack": {
    "ref": "runs/run-1/outputs/implementation_pack.json",
    "sha256": "bb23c8a36dc5e9b3d46d8062fd073dc6acf3db208138d2e4b14530d092aa0f40"
  },
  "kind": "artifact_set",
  "media_type": "application/json",
  "plan_completion": {
    "bytes": 62,
    "ref": "runs/run-2/execplan/code-change/plan-completion.json",
    "sha256": "4cd32a5c9e69d8e96d2fc76382fe3dc73c1cb34f92bb43509efa7d9bfc27f0bb",
    "verdict": "complete"
  },
  "pr": {
    "base_revision": "base-fixture",
    "branch": "impl/liv-315",
    "head_revision": "head-fixture",
    "url": "https://github.com/living-systems/scherzo/pull/315"
  },
  "review_artifacts": [
    {
      "bytes": 43,
      "name": "final-review",
      "ref": "runs/run-2/execplan/code-change/review/final-review.json",
      "sha256": "901c63d7d00aa05be77f85b488662475ee888b1ce79414f4d60f515898faa0df"
    }
  ],
  "review_doc": {
    "path": "test/fixtures/execplan_v2/review-doc.valid.md",
    "sha256": "6f1b07718f377d21629aca606b39beb2424d6b8503b419b7e65166c003389674"
  },
  "schema_version": 2,
  "source_bundle": {
    "implementation_pack_sha256": "bb23c8a36dc5e9b3d46d8062fd073dc6acf3db208138d2e4b14530d092aa0f40",
    "ref": "runs/run-1/outputs/exec_plan_bundle.json",
    "review_doc_sha256": "6f1b07718f377d21629aca606b39beb2424d6b8503b419b7e65166c003389674",
    "sha256": "591e1f2fff461dfb467f27c21122b1dea94cf903946acf5c644937b1b1f9afdc"
  },
  "validation_artifacts": [
    {
      "bytes": 49,
      "name": "scherzo-ci",
      "ref": "runs/run-2/execplan/code-change/validation/scherzo-ci.json",
      "sha256": "b55e06b08ea7c49b652ebf502fa8a5a99dd6a5e326a60383783c4a7c43bfa51d"
    }
  ]
}
